{
  "name": "argus",
  "version": "0.1.0",
  "description": "Security overseer: reviews pending jobs via the content-classifier, quarantines repeat offenders, weekly dependency scan.",
  "kind": "service",
  "launchdaemon_label": "${PREFIX}.argus",
  "requires": ["module:content-classifier"],
  "cost_estimate": "free (local)",
  "uninstall": "uninstall.sh",
  "author": "AI-PandorasBox"
}
